{
  "schema": "nsc-review-run-v2",
  "run_id": "RC-20260914-004-U05-independent",
  "candidate": {
    "candidate_id": "RC-20260914-004",
    "source_sha": "ff895a28f67380f621cfa616e296bc3e703021da",
    "version": "0.4.0-beta.8",
    "product_digest_sha256": "b57935792453d8d980a54275e45031d9592362a0ec483d06efb07d3d1028bd82"
  },
  "evaluator": {
    "contract_id": "U05",
    "model_provider": "independent-synthetic-harness",
    "model_family": "family-beta",
    "model_version": "2026.09",
    "independence_group": "scaled-display-stratum",
    "split": "development",
    "blindness_attestation": {
      "prior_verdicts_exposed": false,
      "candidate_age_exposed": false,
      "author_rationale_exposed": false
    },
    "calibration": {
      "suite_id": "SEED_SUITE_V2",
      "seeded_cases": 24,
      "recall": 1.0,
      "precision": 1.0,
      "passed": true,
      "evidence_ref": "audit/review-system-v2/artifacts/RC-20260914-004/calibration/U05.json",
      "evidence_sha256": "8a612082aaeda8c6cc1e7fc9d799f09ea74118552530959f94e4d8f668748aa9"
    }
  },
  "prompt": {
    "template_ref": "audit/review-system-v2/prompts/REVIEW_TEMPLATE.md",
    "template_sha256": "f600eba338b6c4e3de6c38171430a9c86245dc84c61171316116fcdb8f940f78",
    "rendered_ref": "audit/review-system-v2/artifacts/RC-20260914-004/prompts/U05.txt",
    "rendered_sha256": "925e48b4ebfb3e693eb1dd6a2f11fe624d39ccbefb575c4bfc4e3a4054f27b7f"
  },
  "evidence": [
    {
      "id": "E-font-network-trace",
      "modality": "font-network-trace",
      "sha256": "3914ca614d025549009dee2883f3b9e9d70e649e71ffd5f7fbd21c9e1ac24235",
      "uri": "repo://audit/review-system-v2/artifacts/RC-20260914-004/evidence/font-network.json",
      "local_ref": "audit/review-system-v2/artifacts/RC-20260914-004/evidence/font-network.json",
      "release_equivalent": true
    },
    {
      "id": "E-multi-scale-screenshots",
      "modality": "multi-scale-screenshots",
      "sha256": "c65e1bb27b76140c62cd84a9218f21f23a028d8d5f54e94f4437445eaf5efb87",
      "uri": "repo://audit/review-system-v2/artifacts/RC-20260914-004/evidence/multiscale-font-captures.txt",
      "local_ref": "audit/review-system-v2/artifacts/RC-20260914-004/evidence/multiscale-font-captures.txt",
      "release_equivalent": true
    },
    {
      "id": "E-reduced-motion-capture",
      "modality": "reduced-motion-capture",
      "sha256": "76d7e1253236c809c16f489b5925931c95a677c577879e24ed53f8b5091598db",
      "uri": "repo://audit/review-system-v2/artifacts/RC-20260914-004/evidence/fallback-captures.txt",
      "local_ref": "audit/review-system-v2/artifacts/RC-20260914-004/evidence/fallback-captures.txt",
      "release_equivalent": true
    },
    {
      "id": "E-screenshot",
      "modality": "screenshot",
      "sha256": "02f91fade6671bf0f576e76d173c15f9e9499b3af5e3f1a8b3e23c59eafafb2a",
      "uri": "repo://audit/review-system-v2/artifacts/RC-20260914-004/evidence/desktop-composition.txt",
      "local_ref": "audit/review-system-v2/artifacts/RC-20260914-004/evidence/desktop-composition.txt",
      "release_equivalent": true
    }
  ],
  "observations": [
    {
      "id": "O1",
      "criterion_id": "typography-optical-legibility",
      "epistemic_type": "direct-observation",
      "severity": "INFO",
      "claim": "Direct observation supports the criterion under assigned task.",
      "evidence_refs": [
        "E-multi-scale-screenshots"
      ],
      "confidence": 0.95
    },
    {
      "id": "O2",
      "criterion_id": "cross-browser-font-stability",
      "epistemic_type": "direct-observation",
      "severity": "INFO",
      "claim": "Direct observation supports the criterion under assigned task.",
      "evidence_refs": [
        "E-multi-scale-screenshots",
        "E-font-network-trace"
      ],
      "confidence": 0.95
    },
    {
      "id": "O3",
      "criterion_id": "fallback-compositional-equivalence",
      "epistemic_type": "direct-observation",
      "severity": "INFO",
      "claim": "Direct observation supports the criterion under assigned task.",
      "evidence_refs": [
        "E-screenshot",
        "E-reduced-motion-capture"
      ],
      "confidence": 0.95
    }
  ],
  "verdict": "PASS",
  "vetoes": [],
  "contradictions": [],
  "unknowns": [],
  "raw_output": {
    "ref": "audit/review-system-v2/artifacts/RC-20260914-004/raw/U05.txt",
    "sha256": "67162b6ba63cf3d7430624473712cc9b71d6d476f9e52130abddf1b678e46184"
  }
}
